check_name,value,detail
outer_test_set_held_out,True,The occupancy test split is created once and used only for final evaluation.
fair_price_train_rows_are_oof,True,Training price-gap features use 3-fold out-of-fold blended price predictions.
fair_price_test_rows_use_train_only_price_model,True,Test price-gap features are generated by price models fit only on occupancy training rows.
blend_weight_tuned_on_validation_only,True,The XGB/HGB occupancy blend weight is tuned on a validation split from training data only.
saved_full_price_model_not_used_for_feature_creation,True,The saved full-data price model is not used to create the experimental gap features.
